ActionNumber,FChMotion,WaitTime01,TextBubble1,TextBubble1Audio,Question,Answers,Correct,TextBubble2,TextBubble2Audio,NChMotion,StandingPosition,MovePath,InAction1,InAction2,IsMeA,IsMeB,IsMeC,IsWaterOn,IsWaterOff
0,Idle_01,2,"||2항사|DRILL DRILL DRILL, ENCLOSED SPACE RESCUE DRILL, RESCUE THE BOSUN IN NO.5(P) BALLAST SPACE ON DECK|2기사|""Enclosed Space Drill!"" ""Enclosed Space Drill!"" ",,밀폐구역 구조훈련 비상대응 소집장소는 어디인가?,Muster Station (선미)|갑판|NO.5(P) BALLAST TANK,1,,,Walking_01,E_2nd_point,Engineroom_muster,,,"""false""","""false""","""false""","""false""","""false"""
1,Idle_01,2,"||1항사|브릿지 현장 감도 있습니까?|||선장|네, 감도 좋습니다|||1항사|MUSTER STATION 집결 인원보고 드립니다. 총원 17명, 열외 항해당직 2명, 기관부원 4명, 현재원 11명 이상",,2기사의 소지품은 무엇인가?,"가스검지기, EEBD|삼각구조대, Harness|Portable Fan",1,,,Idle_01,,,,,"""false""","""false""","""false""","""false""","""false"""
2,Idle_01,2,"||선장|전 선원은 현장에서 비상대응을 위해 BALLAST TANK 5(P) 앞으로 이동 바랍니다.|||1항사|네, 현장으로 이동하겠습니다.",,,,,,,Walking_01,,Muster_BWT,,,"""false""","""false""","""false""","""false""","""false"""
3,Idle_01,2,"||1항사|기관장과 2기사는 삼각구조대 설치 바랍니다|||기관장|네, 삼각구조대와 Harness 연결하여 부상자 구조하도록 하겠습니다",,Harness의 용도는?,환자를 수직으로 끌어올리는 들것|긴급으로 산소공급을 위한 장치|밀폐구역의 산소 농도 측정,0,,,Idle_01,,,,,"""false""","""false""","""false""","""false""","""false"""
4,Idle_01,2,"||1항사|심폐소생술 시행 결과, 다행히 갑판장의 호흡이 돌아왔습니다|||선장|다행입니다. 의식이 회복될 때까지 병원 침실에서 휴식을 취하면서 경과를 보고 바랍니다. 훈련 종료하겠습니다.",,"호흡이 정지되어, 뇌사가 진행되기 시작하는 시간은?",2분|4분|6분 ,1,,,Idle_01,,,,,"""false""","""false""","""false""","""false""","""false"""
5,Idle_01,2,"||1항사|밀폐구역 구조훈련 상황 종료합니다. 사용한 물품 제자리에 정리해 주시고, 자기 임무 역할 숙지 바랍니다.",,밀폐구역 구조훈련을 시행해야 하는 주기는?,매월 시행|2개월 주기 시행|3개월 주기 시행,1,,,Idle_01,,,,,"""false""","""false""","""true""","""false""","""false"""